query,category
Can you tell me how transferring money into my account works?,transfer_into_account
HOW DO I TRANSFER MONEY FROM MY BANK ACCOUNT?,transfer_into_account
How would I use a bank transfer for topping my account?,transfer_into_account
How can I deposit money to my account?,transfer_into_account
I need to add money to my account. Can I do so via bank transfer?,transfer_into_account
I tried doing an in country transfer earlier this week. I thought it would be there by now but I still don't see the money. Can you check the status on my transfer?,transfer_not_received_by_recipient
Why is it taking so long for a transfer to complete!,transfer_not_received_by_recipient
Why is my transfer taking so long to complete?,transfer_not_received_by_recipient
What is the time for a transfer?,transfer_not_received_by_recipient
I just sent money but the person I sent it to doesn't see it. What happened?,transfer_not_received_by_recipient
"How long does it take to transfer from china? Is there a way to transfer it quickly, I need it urgently?",transfer_timing
When can I use money sent to my account?,transfer_timing
How long will I have to wait for my money to be in my account?,transfer_timing
"I have been waiting for my transfer, shouldn't it be here already?",transfer_timing
how long does it take for a transfer from Europe to go through?,transfer_timing
The app does not believe that I am myself,unable_to_verify_identity
I don't have the means to prove my identity.,unable_to_verify_identity
"app malfunctioning, does not know its me",unable_to_verify_identity
I am not recognized by the app.,unable_to_verify_identity
"Hearing about your verification results from us may take anywhere from 10 minutes to approximately one hour.  If this verification has in fact, failed, double-check to make sure that your images are clear.  Also make sure that your document photos have no blur or glare. They need to be readable.  You must also be 18 years of age or older and be a resident of Switzerland or the European Economic Area to open an account.",unable_to_verify_identity
What is the identity verification process?,verify_my_identity
"If I'm getting my identity verified, what all do I need?",verify_my_identity
What do I need for the identity check?,verify_my_identity
What needs to be provided for identity verification?,verify_my_identity
If I don't have all my documents can they still verify my identity?,verify_my_identity
How can I tell the source for my available funds?,verify_source_of_funds
need to know where money comes from,verify_source_of_funds
I would like to know where the funds are at.,verify_source_of_funds
Is there a way to see my money's source?,verify_source_of_funds
My source of funds need verification.,verify_source_of_funds
Why does top-up require verification?,verify_top_up
How is top-up verified?,verify_top_up
i don't see the top-up verification code anywhere,verify_top_up
Why do i have to verify my top-up card?,verify_top_up
How are top-ups verified?,verify_top_up
What is the reason I got rejected for using my disposable virtual card to pay a subscription to the gym?,virtual_card_not_working
I can't seem to get my virtual card to work.,virtual_card_not_working
My throwaway virtual card won't work,virtual_card_not_working
I can't get my virtual card to work at all,virtual_card_not_working
My virtual card isn't working.,virtual_card_not_working
This transaction needs both a Visa and a Mastercard.,visa_or_mastercard
Can I select my card scheme or do you choose it for me?,visa_or_mastercard
How can I get a Visa and Mastercard?,visa_or_mastercard
Can you issue both a Visa and a Mastercard to me?,visa_or_mastercard
Which type of card will I receive?,visa_or_mastercard
It's requiring me to verify my identity?,why_verify_identity
do I need to verify my identity before I can use my card?,why_verify_identity
I answered so many questions about my identity. Why do you need this info?,why_verify_identity
Why do you need to know so much about me for my account?,why_verify_identity
what are the reasons I have to proof my identity to you?,why_verify_identity
"Hi, Please help me to request cash back. As i have been withdrawn money from ATM, but i got wrong amount. in Application its showing the amount i have been charged through.",wrong_amount_of_cash_received
"I am calling because the ATM didn't give me the right amount of cash, but my app shows the actual amount I wanted to withdraw. What should I do to get my money back?",wrong_amount_of_cash_received
Why did I only get $20 when I asked for $100?,wrong_amount_of_cash_received
I did not get enough cash,wrong_amount_of_cash_received
My cash withdrawal was not entirely complete,wrong_amount_of_cash_received
The wrong exchange rate was used for my cash withdrawal,wrong_exchange_rate_for_cash_withdrawal
Can i get money in my home currency at my ATM ?I am on holiday and bit concerned because i do not have any cash with me .Is it possible to withdraw without any additional cost.,wrong_exchange_rate_for_cash_withdrawal
The exchange rate applied was incorrect when I was traveling outside the country.,wrong_exchange_rate_for_cash_withdrawal
I exchanged cash when traveling and the rate was incorrect.,wrong_exchange_rate_for_cash_withdrawal
I found the exchange rate for my cash withdrawal is wrong,wrong_exchange_rate_for_cash_withdrawal
